question,status,answer,faithfulness,answer_relevancy,context_precision,answer_similarity,answer_correctness
What is artificial intelligence?,Success,"Artificial intelligence (AI) is the capability of computational systems to perform tasks typically associated with human intelligence, such as learning, reasoning, problem-solving, perception, and decision-making. It is a field of research in engineering, mathematics and computer science that develops and studies methods and software that enable machines to perceive their environment and use learning and intelligence to take actions that maximize their chances of achieving defined goals.",1.0,1.0,0.75,0.6176011562347412,1.0
What is machine learning?,Success,"Machine learning (ML) is a field of study in artificial intelligence concerned with the development and study of statistical algorithms that can learn from data and generalize to unseen data, and thus perform tasks without being explicitly programmed.",1.0,1.0,0.75,0.5609481930732727,1.0
What is deep learning?,Success,"Deep learning refers to a class of machine learning algorithms in which a hierarchy of layers is used to transform input data into a progressively more abstract and composite representation. It uses several layers of neurons between the network's inputs and outputs, and the multiple layers can progressively extract higher-level features from the raw input.",1.0,1.0,0.75,0.7278698086738586,1.0
How do neural networks work?,Success,"Neural networks work by considering examples to learn and improve their ability to do tasks, generally without task-specific programming. They are based on a collection of connected units called artificial neurons, which process and transmit signals to other neurons. The connections between neurons, called synapses, have weights that vary as learning proceeds, increasing or decreasing the strength of the signal. Neurons are typically organized in layers, with different layers performing different transformations on their inputs. Signals travel from the input layer to the output layer, possibly after traversing the layers multiple times. The network learns to model complex relationships between inputs and outputs and finds patterns in data through training algorithms, such as backpropagation.",1.0,1.0,0.8999999999999999,0.794265627861023,1.0
What is natural language processing?,Success,"Natural language processing (NLP) allows programs to read, write and communicate in human languages. Specific problems include speech recognition, speech synthesis, machine translation, information extraction, information retrieval and question answering.",1.0,0.8,1.0,0.5845707654953003,1.0
What is computer vision?,Success,Computer vision is the ability to analyze visual input.,1.0,1.0,0.75,0.5000655651092529,1.0
What is speech recognition?,Not Found,I could not find that information in the knowledge base.,0.75,0.0,0.75,0.1098232716321945,0.75
What is robotics?,Not Found,I could not find that information in the knowledge base.,0.8999999999999999,0.0,0.5,0.2063421010971069,0.8999999999999999
Who coined the term artificial intelligence?,Not Found,I could not find that information in the knowledge base.,1.0,0.3333333333333333,1.0,0.1769772469997406,1.0
What is the history of AI?,Success,"The study of mechanical or ""formal"" reasoning began with philosophers and mathematicians in antiquity, leading to Alan Turing's theory of computation. This, along with discoveries in cybernetics, information theory, and neurobiology, led researchers to consider building an ""electronic brain"". The field of AI research was founded at a workshop at Dartmouth College in 1956, where the first AI program, Logic Theorist, was presented. Many areas of research, such as artificial neurons and the Turing test, were developed in the following years. AI went through cycles of optimism and disappointment, but funding and interest increased substantially after 2012, and an AI boom occurred in the 2020s with advances in generative AI.",1.0,0.6666666666666666,1.0,0.8449023962020874,1.0
What is the Turing test?,Success,"The Turing test is a measure of the ability of a machine to simulate human conversation, proposed by Alan Turing in 1950. It assesses whether a machine can exhibit intelligent behavior equivalent to, or indistinguishable from, that of a human.",1.0,1.0,1.0,0.5166929960250854,1.0
What is supervised learning?,Success,"Supervised learning is a type of machine learning where the computer is presented with example inputs and their desired outputs, given by a ""teacher"", and the goal is to learn a general rule that maps inputs to outputs. Supervised learning algorithms build a mathematical model of a set of data that contains both the inputs and the desired outputs, and through iterative optimisation of an objective function, they learn a function that can be used to predict the output associated with new inputs.",1.0,1.0,1.0,0.8011243343353271,1.0
What is unsupervised learning?,Success,"Unsupervised learning algorithms find structures in data that has not been labelled, classified or categorised. Instead of responding to feedback, unsupervised learning algorithms identify commonalities in the data and react based on the presence or absence of such commonalities in each new piece of data.",1.0,0.5,0.75,0.7222919464111328,1.0
What is reinforcement learning?,Success,"Reinforcement learning is an area of machine learning concerned with how software agents ought to take actions in an environment to maximize some notion of cumulative reward. In reinforcement learning, the environment is typically represented as a Markov decision process (MDP), and the agent learns to choose responses that are classified as ""good"" through rewards and punishments. The goal is to learn a general rule that maps inputs to outputs, and the agent learns from experience by interacting with the dynamic environment.",1.0,1.0,1.0,0.5539727807044983,1.0
What is transfer learning?,Success,Transfer learning is when the knowledge gained from one problem is applied to a new problem.,1.0,1.0,1.0,0.5164710283279419,1.0
What is TensorFlow?,Not Found,I could not find that information in the knowledge base.,0.8999999999999999,0.0,0.5,0.1414871513843536,0.8999999999999999
What is PyTorch?,Not Found,I could not find that information in the knowledge base.,1.0,0.0,0.5,0.1295012086629867,1.0
What hardware is used for AI training?,Success,"Graphics processing units (GPUs), often with AI-specific enhancements, had displaced CPUs as the dominant method for training large-scale commercial cloud AI. Additionally, specialized hardware such as Tensor Processing Units (TPUs), neural processing units (NPUs), and deep learning processors are also used to speed up deep learning algorithms.",1.0,0.8571428571428571,1.0,0.6997818946838379,1.0
What programming languages are used in AI?,Success,"Specialized programming languages such as Prolog were used in early AI research, but general-purpose programming languages like Python have become predominant.",1.0,1.0,1.0,0.5038381814956665,1.0
What is quantum computing?,Not Found,I could not find that information in the knowledge base.,1.0,0.0,0.75,0.1614722907543182,1.0
